<?xml version="1.0" encoding="UTF-8"?>
<!-- ejercicio-ii-1b-dtd.xml -->
<?xml-stylesheet type="text/css" href="../css/ejercicio-ii-2b-dtd.css" ?>

<!DOCTYPE fichero SYSTEM "fichero2b.dtd">
<fichero>
 <ficha>
 <a xmlns="http://www.w3.org/1999/xhtml" href="../index.html" target="marco">Inicio</a>
  <nombre sexo="femenino" edad="17">Angelina</nombre>
  <apellido>Fernandez</apellido>
  <direccion>c/Ulises, 36</direccion>
  <DUI>12345678-9</DUI>
  <fechaNacimiento dia="12" mes="12" anio="2012"></fechaNacimiento>
  <estudios nivel="basico">Escuela Montañita</estudios>
  <estudios nivel="avanzado">Universidad Cerro</estudios>
  <estudios nivel="otro">Curso profesional de llanuras</estudios>
 </ficha>
</fichero>
